"id","description","genome_fraction","observed_region_hits","fold_enrichment","p_value","p_adjust","mean_tss_dist","observed_gene_hits","gene_set_size","fold_enrichment_hyper","p_value_hyper","p_adjust_hyper","fold_enrichment_final","term_name_final","padj_final","neglog10_padj","dataset"
"GO:0010560","positive regulation of glycoprotein biosynthetic process",0.00129548865805445,18,3.13855228554768,3.1771524125451e-05,0.000310958107289179,218707,3,17,2.56773831250877,0.107125217933135,0.527165282383947,3.13855228554768,"positive regulation of glycoprotein biosynthetic process",0.000310958107289179,3.50729811579191,"mouse_specific"
"GO:0042402","biogenic amine catabolic process",0.000525500096958961,11,4.72835812694751,3.23931395433833e-05,0.000316307941291436,78782,7,15,6.79024131530098,2.80587009041071e-05,0.0374280630723055,4.72835812694751,"biogenic amine catabolic process",0.000316307941291436,3.49988990446191,"mouse_specific"
"GO:1901292","nucleoside phosphate catabolic process",0.014906161803818,101,1.53054471014218,3.24503132415577e-05,0.000316307941291436,343433,17,194,1.27504531325608,0.180756001510752,0.599513668212375,1.53054471014218,"nucleoside phosphate catabolic process",0.000316307941291436,3.49988990446191,"mouse_specific"
"GO:0032275","luteinizing hormone secretion",0.00180887122020092,22,2.74729635412257,3.3172060860734e-05,0.000322685941624945,255738,2,13,2.23854109295637,0.223507987641826,0.628775555412844,2.74729635412257,"luteinizing hormone secretion",0.000322685941624945,3.49121995497944,"mouse_specific"
"GO:1901970","positive regulation of mitotic sister chromatid separation",0.000625325900527304,12,4.33476249233591,3.32695471797769e-05,0.000322977794731059,81453,4,19,3.0632667587824,0.0375221035748805,0.40497393365395,4.33476249233591,"positive regulation of mitotic sister chromatid separation",0.000322977794731059,3.49082733512175,"mouse_specific"
"GO:0061025","membrane fusion",0.0125713020926376,88,1.58122214285046,3.36184149620955e-05,0.000325703914997144,172861,20,180,1.61672412269071,0.022859071291183,0.346658338889806,1.58122214285046,"membrane fusion",0.000325703914997144,3.48717702113596,"mouse_specific"
"GO:0046785","microtubule polymerization",0.00685235317943244,55,1.81306522672071,3.37537309270881e-05,0.000326354254983927,162947,9,89,1.47140060604435,0.157211732765505,0.577954218440004,1.81306522672071,"microtubule polymerization",0.000326354254983927,3.48631072063004,"mouse_specific"
"GO:0009620","response to fungus",0.00292473814074309,30,2.31699311925686,3.41695130924284e-05,0.000329708245282988,176240,7,61,1.66973147097565,0.123855650361638,0.534993811038629,2.31699311925686,"response to fungus",0.000329708245282988,3.48187019196474,"mouse_specific"
"GO:0031110","regulation of microtubule polymerization or depolymerization",0.00620384416867815,51,1.85694813375613,3.53785654977661e-05,0.000340687755477482,172694,9,89,1.47140060604435,0.157211732765505,0.577954218440004,1.85694813375613,"regulation of microtubule polymerization or depolymerization",0.000340687755477482,3.46764347495611,"mouse_specific"
"GO:0000271","polysaccharide biosynthetic process",0.00670357939295942,54,1.81960650435867,3.60433455867418e-05,0.000346392473851699,323288,7,61,1.66973147097565,0.123855650361638,0.534993811038629,1.81960650435867,"polysaccharide biosynthetic process",0.000346392473851699,3.46043155256747,"mouse_specific"
"GO:0045730","respiratory burst",0.0013106117283472,18,3.10233671856839,3.67996552625329e-05,0.000352952204582129,294912,5,30,2.42508618403606,0.0516312820627993,0.432975712827046,3.10233671856839,"respiratory burst",0.000352952204582129,3.452284101104,"mouse_specific"
"GO:0046942","carboxylic acid transport",0.029898312606352,180,1.35992921813724,3.68734607125077e-05,0.000352952765940124,275563,28,351,1.16072501116256,0.231517378417908,0.637285742644429,1.35992921813724,"carboxylic acid transport",0.000352952765940124,3.45228341037454,"mouse_specific"
"GO:0033615","mitochondrial proton-transporting ATP synthase complex assembly",0.000135000723414411,6,10.0393508661843,3.79231120540999e-05,0.000360966396923045,237991,2,8,3.6376292760541,0.100215405473596,0.516843675211887,10.0393508661843,"mitochondrial proton-transporting ATP synthase complex assembly",0.000360966396923045,3.44253322554628,"mouse_specific"
"GO:0043461","proton-transporting ATP synthase complex assembly",0.000135000723414411,6,10.0393508661843,3.79231120540999e-05,0.000360966396923045,237991,2,8,3.6376292760541,0.100215405473596,0.516843675211887,10.0393508661843,"proton-transporting ATP synthase complex assembly",0.000360966396923045,3.44253322554628,"mouse_specific"
"GO:0051952","regulation of amine transport",0.0115448618316941,82,1.60441085166949,3.79369196933329e-05,0.000360966396923045,255125,16,107,2.17577825857441,0.00258110715985988,0.236175136599112,1.60441085166949,"regulation of amine transport",0.000360966396923045,3.44253322554628,"mouse_specific"
"GO:0071222","cellular response to lipopolysaccharide",0.0142637087030792,97,1.53613629763272,4.02219025443137e-05,0.000381948463446598,139743,21,214,1.42785448218946,0.0631623265014471,0.45468661712507,1.53613629763272,"cellular response to lipopolysaccharide",0.000381948463446598,3.41799523277076,"mouse_specific"
"GO:0009205","purine ribonucleoside triphosphate metabolic process",0.0139029846600428,95,1.5434978885854,4.0471870226172e-05,0.00038356113049992,388634,17,237,1.04370797793957,0.463733782116841,0.74417124997609,1.5434978885854,"purine ribonucleoside triphosphate metabolic process",0.00038356113049992,3.41616541001208,"mouse_specific"
"GO:1902338","negative regulation of apoptotic process involved in morphogenesis",0.000743797277796793,13,3.94801910638147,4.10835522256276e-05,0.000388588697533307,66234,2,7,4.15729060120468,0.078650744216685,0.486282957758313,3.94801910638147,"negative regulation of apoptotic process involved in morphogenesis",0.000388588697533307,3.41050983541483,"mouse_specific"
"GO:0051933","amino acid neurotransmitter reuptake",0.000357326385624335,9,5.68941876701002,4.13894384950517e-05,0.000389940654797869,173845,2,5,5.82020684168655,0.0410469934113886,0.408365586312933,5.68941876701002,"amino acid neurotransmitter reuptake",0.000389940654797869,3.40900148337077,"mouse_specific"
"GO:0051935","glutamate reuptake",0.000357326385624335,9,5.68941876701002,4.13894384950517e-05,0.000389940654797869,173845,2,5,5.82020684168655,0.0410469934113886,0.408365586312933,5.68941876701002,"glutamate reuptake",0.000389940654797869,3.40900148337077,"mouse_specific"
"GO:0042415","norepinephrine metabolic process",0.00238708973707114,26,2.46033973370373,4.23515077785386e-05,0.000398220660565984,450256,2,17,1.71182554167252,0.328002138256884,0.678585329355418,2.46033973370373,"norepinephrine metabolic process",0.000398220660565984,3.3998762115687,"mouse_specific"
"GO:0015849","organic acid transport",0.0299887068224216,180,1.35583001718431,4.30598876164286e-05,0.000404087494376916,275563,28,353,1.15414866549025,0.240768531206127,0.649347152433654,1.35583001718431,"organic acid transport",0.000404087494376916,3.39352458981258,"mouse_specific"
"GO:0003406","retinal pigment epithelium development",0.00054359309524711,11,4.5709790574843,4.37421501426064e-05,0.00040968675260766,73353,2,12,2.42508618403606,0.19760317285674,0.609361330729612,4.5709790574843,"retinal pigment epithelium development",0.00040968675260766,3.38754807891337,"mouse_specific"
"GO:0099639","neurotransmitter receptor transport, endosome to plasma membrane",0.00133262990234153,18,3.05107883403616,4.53837211777723e-05,0.00042423142491566,200173,2,11,2.64554856440298,0.172106441713288,0.586625100161719,3.05107883403616,"neurotransmitter receptor transport, endosome to plasma membrane",0.00042423142491566,3.37239716429193,"mouse_specific"
"GO:1903169","regulation of calcium ion transmembrane transport",0.0146779978328889,99,1.52355751391381,4.55503640201756e-05,0.000424889634840207,263838,17,139,1.77955964583941,0.0146832302177736,0.314213086715083,1.52355751391381,"regulation of calcium ion transmembrane transport",0.000424889634840207,3.37172386337179,"mouse_specific"
"GO:0097494","regulation of vesicle size",0.000751654662786403,13,3.90674868313926,4.56316908290569e-05,0.000424889634840207,214096,1,17,0.855912770836258,0.702094836313171,0.853449685716247,3.90674868313926,"regulation of vesicle size",0.000424889634840207,3.37172386337179,"mouse_specific"
"GO:0031620","regulation of fever generation",0.000648081720936119,12,4.18255780332234,4.66405829417657e-05,0.000433440446522895,150650,2,9,3.23344824538142,0.123168910855716,0.534993811038629,4.18255780332234,"regulation of fever generation",0.000433440446522895,3.36307056490797,"mouse_specific"
"GO:1902475","L-alpha-amino acid transmembrane transport",0.00562137868994239,47,1.88862395099595,4.71510042816614e-05,0.000437334702503936,284907,8,69,1.68701647585118,0.0998912832904724,0.516843675211887,1.88862395099595,"L-alpha-amino acid transmembrane transport",0.000437334702503936,3.35918606002536,"mouse_specific"
"GO:0010903","negative regulation of very-low-density lipoprotein particle remodeling",0.000207056645189162,7,7.63658772229088,4.8462278073342e-05,0.000448627587735038,56326,1,6,2.42508618403606,0.347713552515212,0.686489224423375,7.63658772229088,"negative regulation of very-low-density lipoprotein particle remodeling",0.000448627587735038,3.34811402359143,"mouse_specific"
"GO:0009137","purine nucleoside diphosphate catabolic process",0.00865395519754159,65,1.69663800943323,4.92254407193441e-05,0.000453936337731755,473743,10,114,1.27636114949267,0.257448021961764,0.656724913582535,1.69663800943323,"purine nucleoside diphosphate catabolic process",0.000453936337731755,3.34300505046993,"mouse_specific"
"GO:0009181","purine ribonucleoside diphosphate catabolic process",0.00865395519754159,65,1.69663800943323,4.92254407193441e-05,0.000453936337731755,473743,10,114,1.27636114949267,0.257448021961764,0.656724913582535,1.69663800943323,"purine ribonucleoside diphosphate catabolic process",0.000453936337731755,3.34300505046993,"mouse_specific"
"GO:1902170","cellular response to reactive nitrogen species",0.00172800134693004,21,2.74514757285252,4.99356552862425e-05,0.00045960008884607,254439,2,16,1.81881463802705,0.302016618218796,0.656724913582535,2.74514757285252,"cellular response to reactive nitrogen species",0.00045960008884607,3.33761989602954,"mouse_specific"
"GO:0050832","defense response to fungus",0.00227315501713033,25,2.48428509298819,5.05339256543165e-05,0.000464213758505871,200696,6,51,1.71182554167252,0.135572938927367,0.557601901579639,2.48428509298819,"defense response to fungus",0.000464213758505871,3.33328199193992,"mouse_specific"
"GO:0106070","regulation of adenylate cyclase-activating G protein-coupled receptor signaling pathway",0.00270505622438342,28,2.33814915966223,5.24385171991026e-05,0.00048078686458794,319573,5,24,3.03135773004508,0.0215838193264992,0.339803155581003,2.33814915966223,"regulation of adenylate cyclase-activating G protein-coupled receptor signaling pathway",0.00048078686458794,3.31804740605295,"mouse_specific"
"GO:0006399","tRNA metabolic process",0.0102442329474629,74,1.63170916262112,5.27631418559859e-05,0.000482016257927459,394299,10,171,0.85090743299511,0.745581538357315,0.875405436228578,1.63170916262112,"tRNA metabolic process",0.000482016257927459,3.31693831319454,"mouse_specific"
"GO:0007613","memory",0.0216420881789689,136,1.41948309311307,5.2774032418301e-05,0.000482016257927459,351966,21,171,1.78690560928973,0.00692008189582605,0.271360215485194,1.41948309311307,"memory",0.000482016257927459,3.31693831319454,"mouse_specific"
"GO:2000849","regulation of glucocorticoid secretion",0.00122683918566342,17,3.13005349730254,5.36196827936915e-05,0.000488807241620205,284851,2,12,2.42508618403606,0.19760317285674,0.609361330729612,3.13005349730254,"regulation of glucocorticoid secretion",0.000488807241620205,3.31086236869758,"mouse_specific"
"GO:1903020","positive regulation of glycoprotein metabolic process",0.0013530096924343,18,3.00512177508686,5.48646201816356e-05,0.000499205460435947,218707,3,19,2.2974500690868,0.138190120012449,0.55812482226125,3.00512177508686,"positive regulation of glycoprotein metabolic process",0.000499205460435947,3.30172067287645,"mouse_specific"
"GO:0070633","transepithelial transport",0.00391335973599028,36,2.07798881929724,5.58118054982211e-05,0.000506860153917431,132588,4,40,1.45505171042164,0.294549984822909,0.656724913582535,2.07798881929724,"transepithelial transport",0.000506860153917431,3.29511184887123,"mouse_specific"
"GO:0060763","mammary duct terminal end bud growth",0.00201203302198581,23,2.58216036043577,5.62134187072684e-05,0.000509540571842778,144076,1,8,1.81881463802705,0.434320489387543,0.723225381818469,2.58216036043577,"mammary duct terminal end bud growth",0.000509540571842778,3.29282122985986,"mouse_specific"
"GO:0032609","type II interferon production",0.00750003530526082,58,1.74684818835735,5.69196346976034e-05,0.000513995040873075,271289,6,113,0.772593828542463,0.797003866587341,0.895203122620749,1.74684818835735,"type II interferon production",0.000513995040873075,3.28904107114451,"mouse_specific"
"GO:0032649","regulation of type II interferon production",0.00750003530526082,58,1.74684818835735,5.69196346976034e-05,0.000513995040873075,271289,6,113,0.772593828542463,0.797003866587341,0.895203122620749,1.74684818835735,"regulation of type II interferon production",0.000513995040873075,3.28904107114451,"mouse_specific"
"GO:1901029","negative regulation of mitochondrial outer membrane permeabilization involved in apoptotic signaling pathway",0.000664509959408017,12,4.07915520409465,5.8976825994761e-05,0.000531568906235266,116718,1,15,0.970034473614426,0.65645983565711,0.829276283726171,4.07915520409465,"negative regulation of mitochondrial outer membrane permeabilization involved in apoptotic signaling pathway",0.000531568906235266,3.27444043074922,"mouse_specific"
"GO:0043307","eosinophil activation",0.00014768885718162,6,9.17685772244323,6.19919084834617e-05,0.000557694124063623,22290,1,7,2.07864530060234,0.3925573538983,0.709508873020114,9.17685772244323,"eosinophil activation",0.000557694124063623,3.25360393126635,"mouse_specific"
"GO:1902730","positive regulation of proteoglycan biosynthetic process",0.000468421738347519,10,4.82229124807918,6.21217169625428e-05,0.000557813390961969,257264,1,5,2.91010342084328,0.2995620335765,0.656724913582535,4.82229124807918,"positive regulation of proteoglycan biosynthetic process",0.000557813390961969,3.25351106419854,"mouse_specific"
"GO:1900103","positive regulation of endoplasmic reticulum unfolded protein response",0.000377887290331397,9,5.37985663009751,6.31878596524429e-05,0.00056632415036815,483709,1,6,2.42508618403606,0.347713552515212,0.686489224423375,5.37985663009751,"positive regulation of endoplasmic reticulum unfolded protein response",0.00056632415036815,3.24693491789318,"mouse_specific"
"GO:0006090","pyruvate metabolic process",0.011019072039272,78,1.59896905304756,6.40166114475427e-05,0.000572679443715775,404115,12,138,1.26526235688838,0.239797268674245,0.649347152433654,1.59896905304756,"pyruvate metabolic process",0.000572679443715775,3.24208840557365,"mouse_specific"
"GO:0097254","renal tubular secretion",0.00189492571910497,22,2.62253304086371,6.46200631992572e-05,0.000576999295656054,155572,2,18,1.61672412269071,0.353715509282917,0.686489224423375,2.62253304086371,"renal tubular secretion",0.000576999295656054,3.2388247169879,"mouse_specific"
"GO:0072044","collecting duct development",0.00137259249030452,18,2.9622476571585,6.55850000639371e-05,0.000584524786417138,75909,4,15,3.8801378944577,0.0164348866148607,0.326087287370147,2.9622476571585,"collecting duct development",0.000584524786417138,3.23319706811899,"mouse_specific"
"GO:1904872","regulation of telomerase RNA localization to Cajal body",9.20304019782815e-05,5,12.2723904312422,6.6601291357041e-05,0.00059215764311054,263232,2,7,4.15729060120468,0.078650744216685,0.486282957758313,12.2723904312422,"regulation of telomerase RNA localization to Cajal body",0.00059215764311054,3.2275626608124,"mouse_specific"
"GO:0006198","cAMP catabolic process",0.00112732681588144,16,3.20597862826793,6.66888779015004e-05,0.00059215764311054,171356,2,9,3.23344824538142,0.123168910855716,0.534993811038629,3.20597862826793,"cAMP catabolic process",0.00059215764311054,3.2275626608124,"mouse_specific"
"GO:0043370","regulation of CD4-positive, alpha-beta T cell differentiation",0.00475181445686964,41,1.94901355807536,7.15541038386363e-05,0.00063418137216984,330351,5,57,1.27636114949267,0.354311093310802,0.686531535459715,1.94901355807536,"regulation of CD4-positive, alpha-beta T cell differentiation",0.00063418137216984,3.19778651866759,"mouse_specific"
"GO:0045842","positive regulation of mitotic metaphase/anaphase transition",0.000578640091906875,11,4.29412460166604,7.56622403031143e-05,0.000669352092589104,81570,3,15,2.91010342084328,0.0792521326894032,0.486282957758313,4.29412460166604,"positive regulation of mitotic metaphase/anaphase transition",0.000669352092589104,3.17434537454285,"mouse_specific"
"GO:0031394","positive regulation of prostaglandin biosynthetic process",0.00178651015931547,21,2.65524306071032,7.89487301703035e-05,0.00069713768006471,173640,1,10,1.45505171042164,0.50943616708327,0.76216364353252,2.65524306071032,"positive regulation of prostaglandin biosynthetic process",0.00069713768006471,3.15668144315371,"mouse_specific"
"GO:1902101","positive regulation of metaphase/anaphase transition of cell cycle",0.000586304053522006,11,4.2379933061035,8.48238418084256e-05,0.00074763702927279,81570,3,16,2.72822195704057,0.0927537091865279,0.516843675211887,4.2379933061035,"positive regulation of metaphase/anaphase transition of cell cycle",0.00074763702927279,3.12630919684566,"mouse_specific"
"GO:0046032","ADP catabolic process",0.00865355208564523,64,1.67061370545608,8.55497950203396e-05,0.000751731098282659,480867,9,113,1.15889074281369,0.373458019308428,0.705653792124228,1.67061370545608,"ADP catabolic process",0.000751731098282659,3.12393748310073,"mouse_specific"
"GO:0035934","corticosterone secretion",0.00115236986769347,16,3.1363069966618,8.56024756715522e-05,0.000751731098282659,298492,1,8,1.81881463802705,0.434320489387543,0.723225381818469,3.1363069966618,"corticosterone secretion",0.000751731098282659,3.12393748310073,"mouse_specific"
"GO:0006937","regulation of muscle contraction",0.0181203035142444,116,1.44604896659837,8.88104266983623e-05,0.000778473813513483,326671,16,163,1.42827161759179,0.0950833427439593,0.516843675211887,1.44604896659837,"regulation of muscle contraction",0.000778473813513483,3.1087559917508,"mouse_specific"
"GO:0010640","regulation of platelet-derived growth factor receptor signaling pathway",0.00309943945136779,30,2.18639475107001,9.38763643041083e-05,0.000821375282558432,406221,3,27,1.61672412269071,0.28273440102766,0.656724913582535,2.18639475107001,"regulation of platelet-derived growth factor receptor signaling pathway",0.000821375282558432,3.08545837040128,"mouse_specific"
"GO:0014905","myoblast fusion involved in skeletal muscle regeneration",0.000232384996478541,7,6.80425267737244,9.8696958322487e-05,0.000861977449874859,97344,1,5,2.91010342084328,0.2995620335765,0.656724913582535,6.80425267737244,"myoblast fusion involved in skeletal muscle regeneration",0.000861977449874859,3.0645040955709,"mouse_specific"
"GO:0055091","phospholipid homeostasis",0.000927617181732415,14,3.40917841025161,9.90335020771651e-05,0.000863341240330259,181776,3,16,2.72822195704057,0.0927537091865279,0.516843675211887,3.40917841025161,"phospholipid homeostasis",0.000863341240330259,3.06381751309083,"mouse_specific"
"GO:0042403","thyroid hormone metabolic process",0.00311186998036808,30,2.17766108175519,0.000100501647424351,0.000874547062859901,397086,2,34,0.855912770836258,0.688505453072929,0.848618876746598,2.17766108175519,"thyroid hormone metabolic process",0.000874547062859901,3.058216814441,"mouse_specific"
"GO:2000573","positive regulation of DNA biosynthetic process",0.00387968077010637,35,2.03780456198068,0.000101346218630694,0.000880295830066242,383121,4,49,1.18779731462991,0.437469865822382,0.723225381818469,2.03780456198068,"positive regulation of DNA biosynthetic process",0.000880295830066242,3.0553713553782,"mouse_specific"
"GO:0032825","positive regulation of natural killer cell differentiation",0.00129511939524863,17,2.96503341529865,0.000101904369124517,0.00088354041780786,324658,2,11,2.64554856440298,0.172106441713288,0.586625100161719,2.96503341529865,"positive regulation of natural killer cell differentiation",0.00088354041780786,3.05377357877812,"mouse_specific"
"GO:1902455","negative regulation of stem cell population maintenance",0.00182513504880451,21,2.59905079710021,0.000105517686746354,0.000913214554734266,56674,4,23,2.53052471377676,0.0691018924496302,0.469092633051832,2.59905079710021,"negative regulation of stem cell population maintenance",0.000913214554734266,3.03942717537891,"mouse_specific"
"GO:0003044","regulation of systemic arterial blood pressure mediated by a chemical signal",0.00632835211362568,50,1.7847189984733,0.000107463534538597,0.000928376311013947,114508,9,63,2.07864530060234,0.0275275677936148,0.366548231458448,1.7847189984733,"regulation of systemic arterial blood pressure mediated by a chemical signal",0.000928376311013947,3.03227594978353,"mouse_specific"
"GO:0042996","regulation of Golgi to plasma membrane protein transport",0.00130183734072313,17,2.94973278426668,0.000108266567442976,0.000933628453661409,527066,1,11,1.32277428220149,0.543169139620268,0.781937543784891,2.94973278426668,"regulation of Golgi to plasma membrane protein transport",0.000933628453661409,3.02982592101599,"mouse_specific"
"GO:0060717","chorion development",0.000710011489458344,12,3.81773999341875,0.000108861701974969,0.000937072132467988,69012,1,11,1.32277428220149,0.543169139620268,0.781937543784891,3.81773999341875,"chorion development",0.000937072132467988,3.02822697738642,"mouse_specific"
"GO:0060416","response to growth hormone",0.00268324202412946,27,2.27297361852238,0.000110794670881216,0.000950776332130746,232555,7,33,3.08647332513681,0.00626112022406748,0.266215197843975,2.27297361852238,"response to growth hormone",0.000950776332130746,3.02192163779046,"mouse_specific"
"GO:0032534","regulation of microvillus assembly",0.00169647377648863,20,2.66301322254293,0.000110851064214157,0.000950776332130746,374090,1,12,1.21254309201803,0.574584227507862,0.794482645326004,2.66301322254293,"regulation of microvillus assembly",0.000950776332130746,3.02192163779046,"mouse_specific"
"GO:1902514","regulation of calcium ion transmembrane transport via high voltage-gated calcium channel",0.00225266400859723,24,2.40660768649639,0.000112918113392442,0.00096677297083404,229078,5,16,4.54703659506762,0.00350364285385227,0.236175136599112,2.40660768649639,"regulation of calcium ion transmembrane transport via high voltage-gated calcium channel",0.00096677297083404,3.01467550015694,"mouse_specific"
"GO:0090670","RNA localization to Cajal body",0.000103322810259198,5,10.9311101952059,0.000114005612147434,0.000969148951576586,263232,2,8,3.6376292760541,0.100215405473596,0.516843675211887,10.9311101952059,"RNA localization to Cajal body",0.000969148951576586,3.0136094697228,"mouse_specific"
"GO:0090671","telomerase RNA localization to Cajal body",0.000103322810259198,5,10.9311101952059,0.000114005612147434,0.000969148951576586,263232,2,8,3.6376292760541,0.100215405473596,0.516843675211887,10.9311101952059,"telomerase RNA localization to Cajal body",0.000969148951576586,3.0136094697228,"mouse_specific"
"GO:0090672","telomerase RNA localization",0.000103322810259198,5,10.9311101952059,0.000114005612147434,0.000969148951576586,263232,2,8,3.6376292760541,0.100215405473596,0.516843675211887,10.9311101952059,"telomerase RNA localization",0.000969148951576586,3.0136094697228,"mouse_specific"
"GO:0090685","RNA localization to nucleus",0.000103322810259198,5,10.9311101952059,0.000114005612147434,0.000969148951576586,263232,2,8,3.6376292760541,0.100215405473596,0.516843675211887,10.9311101952059,"RNA localization to nucleus",0.000969148951576586,3.0136094697228,"mouse_specific"
"GO:0034351","negative regulation of glial cell apoptotic process",0.000505191521835878,10,4.47130632959656,0.000114415963236394,0.000970912766045006,142625,2,9,3.23344824538142,0.123168910855716,0.534993811038629,4.47130632959656,"negative regulation of glial cell apoptotic process",0.000970912766045006,3.01281978855459,"mouse_specific"
"GO:0060525","prostate glandular acinus development",0.000826059359765333,13,3.55486059119344,0.000115430013248402,0.000977784147622751,130914,5,12,6.06271546009016,0.000800662013756516,0.17418038171994,3.55486059119344,"prostate glandular acinus development",0.000977784147622751,3.00975700803738,"mouse_specific"
"GO:0010901","regulation of very-low-density lipoprotein particle remodeling",0.0002393069156934,7,6.60744061611716,0.000118055856411108,0.000998260298204178,56326,1,9,1.61672412269071,0.473214436704022,0.74417124997609,6.60744061611716,"regulation of very-low-density lipoprotein particle remodeling",0.000998260298204178,3.00075620086297,"mouse_specific"
"GO:0002828","regulation of type 2 immune response",0.00254857627483176,26,2.30444416595702,0.000118727938792402,0.00100217268970094,448337,2,29,1.00348393822182,0.601920652911769,0.807257268115233,2.30444416595702,"regulation of type 2 immune response",0.00100217268970094,2.99905743643069,"mouse_specific"
